{
 "schema_version": "1.2",
 "country": "VN",
 "common_variation": {
  "spine_01.flexion": [
   -2,
   3
  ],
  "spine_02.lateral": [
   -3,
   3
  ],
  "spine_02.twist": [
   -6,
   6
  ],
  "spine_03.flexion": [
   -2,
   3
  ],
  "neck_01.twist": [
   -20,
   20
  ],
  "neck_01.flexion": [
   -5,
   10
  ],
  "head.twist": [
   -10,
   10
  ],
  "head.lateral": [
   -5,
   5
  ],
  "thigh_l.abduction": [
   0,
   7
  ],
  "thigh_r.abduction": [
   0,
   7
  ],
  "thigh_l.twist": [
   -5,
   10
  ],
  "thigh_r.twist": [
   -5,
   10
  ],
  "calf_l.flexion": [
   0,
   6
  ],
  "calf_r.flexion": [
   0,
   6
  ]
 },
 "gestures": [
  {
   "id": "VN_ARM_VERTICAL",
   "label": "ARM_RAISED_VERTICAL",
   "signalling": true,
   "description": "Tay giơ thẳng đứng - one arm raised straight up. All road users on every side must stop (vehicles already inside the intersection may clear it).",
   "source": {
    "ref": "Luật GTĐB 2008 Đ10 k2(a)"
   },
   "instructions": {
    "front": "STOP",
    "back": "STOP",
    "left": "STOP",
    "right": "STOP"
   },
   "pose_variants": [
    {
     "id": "arm_r",
     "pose": "arm_vertical_r",
     "weight": 4.0,
     "signal_arms": [
      "r"
     ],
     "hands": {
      "r": {
       "open_flat": 3,
       "open_spread": 1
      },
      "l": {
       "relaxed": 3,
       "fist": 1
      }
     },
     "variation": {
      "upperarm_r.flexion": [
       -10,
       6
      ],
      "upperarm_r.twist": [
       -20,
       20
      ],
      "lowerarm_r.flexion": [
       -3,
       10
      ],
      "hand_r.flexion": [
       -15,
       15
      ],
      "hand_r.deviation": [
       -10,
       10
      ],
      "upperarm_r.abduction": [
       -5,
       12
      ],
      "upperarm_l.abduction": [
       -2,
       10
      ],
      "upperarm_l.flexion": [
       -10,
       12
      ],
      "upperarm_l.twist": [
       -20,
       20
      ],
      "lowerarm_l.flexion": [
       -5,
       25
      ],
      "hand_l.flexion": [
       -10,
       15
      ]
     },
     "constraints": [
      {
       "type": "limb_direction",
       "from": "upperarm_r",
       "to": "hand_r",
       "direction": "up",
       "max_angle_deg": 20
      },
      {
       "type": "above",
       "joint": "hand_r",
       "reference": "head_end",
       "margin_cm": 10
      },
      {
       "type": "palm_facing",
       "side": "r",
       "direction": "forward",
       "max_angle_deg": 55
      },
      {
       "type": "finger_curl",
       "side": "r",
       "fingers": [
        "index",
        "middle",
        "ring",
        "pinky"
       ],
       "max_deg": 60
      },
      {
       "type": "limb_direction",
       "from": "upperarm_l",
       "to": "hand_l",
       "direction": "down",
       "max_angle_deg": 35
      }
     ],
     "baton_axis": "along"
    },
    {
     "id": "arm_l",
     "pose": "arm_vertical_l",
     "weight": 1.0,
     "signal_arms": [
      "l"
     ],
     "hands": {
      "l": {
       "open_flat": 3,
       "open_spread": 1
      },
      "r": {
       "relaxed": 3,
       "fist": 1
      }
     },
     "variation": {
      "upperarm_l.flexion": [
       -10,
       6
      ],
      "upperarm_l.twist": [
       -20,
       20
      ],
      "lowerarm_l.flexion": [
       -3,
       10
      ],
      "hand_l.flexion": [
       -15,
       15
      ],
      "hand_l.deviation": [
       -10,
       10
      ],
      "upperarm_l.abduction": [
       -5,
       12
      ],
      "upperarm_r.abduction": [
       -2,
       10
      ],
      "upperarm_r.flexion": [
       -10,
       12
      ],
      "upperarm_r.twist": [
       -20,
       20
      ],
      "lowerarm_r.flexion": [
       -5,
       25
      ],
      "hand_r.flexion": [
       -10,
       15
      ]
     },
     "constraints": [
      {
       "type": "limb_direction",
       "from": "upperarm_l",
       "to": "hand_l",
       "direction": "up",
       "max_angle_deg": 20
      },
      {
       "type": "above",
       "joint": "hand_l",
       "reference": "head_end",
       "margin_cm": 10
      },
      {
       "type": "palm_facing",
       "side": "l",
       "direction": "forward",
       "max_angle_deg": 55
      },
      {
       "type": "finger_curl",
       "side": "l",
       "fingers": [
        "index",
        "middle",
        "ring",
        "pinky"
       ],
       "max_deg": 60
      },
      {
       "type": "limb_direction",
       "from": "upperarm_r",
       "to": "hand_r",
       "direction": "down",
       "max_angle_deg": 35
      }
     ],
     "baton_axis": "along"
    }
   ]
  },
  {
   "id": "VN_ARMS_HORIZONTAL",
   "label": "ARMS_EXTENDED_SIDEWAYS",
   "signalling": true,
   "description": "Hai tay hoặc một tay dang ngang - both arms or one arm extended sideways. Front and back must stop; left and right may proceed.",
   "source": {
    "ref": "Luật GTĐB 2008 Đ10 k2(b)"
   },
   "instructions": {
    "front": "STOP",
    "back": "STOP",
    "left": "PROCEED",
    "right": "PROCEED"
   },
   "pose_variants": [
    {
     "id": "both",
     "pose": "arms_horizontal",
     "weight": 3.0,
     "signal_arms": [
      "l",
      "r"
     ],
     "hands": {
      "l": {
       "open_flat": 3,
       "open_spread": 1
      },
      "r": {
       "open_flat": 3,
       "open_spread": 1
      }
     },
     "variation": {
      "upperarm_l.abduction": [
       -10,
       6
      ],
      "upperarm_l.twist": [
       -20,
       20
      ],
      "lowerarm_l.flexion": [
       -3,
       10
      ],
      "hand_l.flexion": [
       -15,
       15
      ],
      "hand_l.deviation": [
       -10,
       10
      ],
      "upperarm_r.abduction": [
       -10,
       6
      ],
      "upperarm_r.twist": [
       -20,
       20
      ],
      "lowerarm_r.flexion": [
       -3,
       10
      ],
      "hand_r.flexion": [
       -15,
       15
      ],
      "hand_r.deviation": [
       -10,
       10
      ],
      "upperarm_l.flexion": [
       -8,
       8
      ],
      "upperarm_r.flexion": [
       -8,
       8
      ]
     },
     "constraints": [
      {
       "type": "limb_direction",
       "from": "upperarm_l",
       "to": "hand_l",
       "direction": "left",
       "max_angle_deg": 20
      },
      {
       "type": "finger_curl",
       "side": "l",
       "fingers": [
        "index",
        "middle",
        "ring",
        "pinky"
       ],
       "max_deg": 60
      },
      {
       "type": "limb_direction",
       "from": "upperarm_r",
       "to": "hand_r",
       "direction": "right",
       "max_angle_deg": 20
      },
      {
       "type": "finger_curl",
       "side": "r",
       "fingers": [
        "index",
        "middle",
        "ring",
        "pinky"
       ],
       "max_deg": 60
      }
     ],
     "baton_axis": "along"
    },
    {
     "id": "right_only",
     "pose": "arm_horizontal_r",
     "weight": 1.0,
     "signal_arms": [
      "r"
     ],
     "hands": {
      "r": {
       "open_flat": 3,
       "open_spread": 1
      },
      "l": {
       "relaxed": 3,
       "fist": 1
      }
     },
     "variation": {
      "upperarm_r.abduction": [
       -10,
       6
      ],
      "upperarm_r.twist": [
       -20,
       20
      ],
      "lowerarm_r.flexion": [
       -3,
       10
      ],
      "hand_r.flexion": [
       -15,
       15
      ],
      "hand_r.deviation": [
       -10,
       10
      ],
      "upperarm_r.flexion": [
       -8,
       8
      ],
      "upperarm_l.abduction": [
       -2,
       10
      ],
      "upperarm_l.flexion": [
       -10,
       12
      ],
      "upperarm_l.twist": [
       -20,
       20
      ],
      "lowerarm_l.flexion": [
       -5,
       25
      ],
      "hand_l.flexion": [
       -10,
       15
      ]
     },
     "constraints": [
      {
       "type": "limb_direction",
       "from": "upperarm_r",
       "to": "hand_r",
       "direction": "right",
       "max_angle_deg": 20
      },
      {
       "type": "finger_curl",
       "side": "r",
       "fingers": [
        "index",
        "middle",
        "ring",
        "pinky"
       ],
       "max_deg": 60
      },
      {
       "type": "limb_direction",
       "from": "upperarm_l",
       "to": "hand_l",
       "direction": "down",
       "max_angle_deg": 35
      }
     ],
     "baton_axis": "along"
    },
    {
     "id": "left_only",
     "pose": "arm_horizontal_l",
     "weight": 1.0,
     "signal_arms": [
      "l"
     ],
     "hands": {
      "l": {
       "open_flat": 3,
       "open_spread": 1
      },
      "r": {
       "relaxed": 3,
       "fist": 1
      }
     },
     "variation": {
      "upperarm_l.abduction": [
       -10,
       6
      ],
      "upperarm_l.twist": [
       -20,
       20
      ],
      "lowerarm_l.flexion": [
       -3,
       10
      ],
      "hand_l.flexion": [
       -15,
       15
      ],
      "hand_l.deviation": [
       -10,
       10
      ],
      "upperarm_l.flexion": [
       -8,
       8
      ],
      "upperarm_r.abduction": [
       -2,
       10
      ],
      "upperarm_r.flexion": [
       -10,
       12
      ],
      "upperarm_r.twist": [
       -20,
       20
      ],
      "lowerarm_r.flexion": [
       -5,
       25
      ],
      "hand_r.flexion": [
       -10,
       15
      ]
     },
     "constraints": [
      {
       "type": "limb_direction",
       "from": "upperarm_l",
       "to": "hand_l",
       "direction": "left",
       "max_angle_deg": 20
      },
      {
       "type": "finger_curl",
       "side": "l",
       "fingers": [
        "index",
        "middle",
        "ring",
        "pinky"
       ],
       "max_deg": 60
      },
      {
       "type": "limb_direction",
       "from": "upperarm_r",
       "to": "hand_r",
       "direction": "down",
       "max_angle_deg": 35
      }
     ],
     "baton_axis": "along"
    }
   ]
  },
  {
   "id": "VN_RIGHT_ARM_FORWARD",
   "label": "RIGHT_ARM_EXTENDED_FORWARD",
   "signalling": true,